{
  "finding_id": "OBJ-TYUMENSKAYA-5-GOLD-SEED-FREE-HEATING-001-270",
  "finding_group_id": "G-TR-002",
  "object_id": "OBJ-TYUMENSKAYA-5-GOLD-SEED",
  "matrix_scope": "FREE_SEARCH",
  "parameter_code": "FREE-HEATING-001",
  "parameter_id": null,
  "parameter_mapping_status": "MATRIX_GAP_CONFIRMED",
  "location": "270",
  "location_type": "ROOM",
  "pd_value": "Тёплый пол предусмотрен",
  "rd_value": "Тёплый пол отсутствует",
  "id_value": null,
  "comparison_result": "MISSING_DESIGN_ELEMENT",
  "finding_status": "SUSPICION",
  "violation_label": "VIOLATION_PRESENT",
  "protocol_status": "WARNING",
  "criticality": "Существенное (предписание) — требует утверждения",
  "criticality_level": "SUBSTANTIAL_ORDER",
  "evidence": [
    {
      "stage": "PD",
      "file_id": "F0171",
      "pdf_page_number": 99
    },
    {
      "stage": "RD",
      "file_id": "F0202",
      "pdf_page_number": 17
    }
  ]
}
